titel,unternehmen,arbeitsort,anforderungen_sektion,anforderungen,veroeffentlicht_am,url
Senior Epic Application Analyst myChart (a),Insel Gruppe,Bern,Das bringst du mit,"Ausbildung in Informatik/Wirtschaftsinformatik und Erfahrung in EpicCare Ambulatory, Cogito, Clarity Data Model, Caboodle Data Model sowie gute Kenntnisse in SQL und M-Code | Mindestens 5 Jahre nachweisbare Erfahrung mit Epic MyChart in mehr als zwei Gesundheitsorganisationen | Fundiertes Verständnis von patientenzentrierten digitalen Services und datengetriebenen Auswertungen | Sehr gute Englischkenntnisse (Niveau C2) sowie sehr gute Deutschkenntnisse (Niveau B1+) | Wohnsitz in der Schweiz und Bereitschaft, mindestens drei Tage pro Woche vor Ort in Bern zu arbeiten",2026-03-23T02:05:40+01:00,https://www.jobs.ch/de/stellenangebote/detail/26c179c0-47d3-4a15-9872-526fed9b7153/
Projektingenieur/in BESS (Battery Energy Storage Systems) (w/m/d),Axpo Group,Baden,(nicht gefunden),(keine Anforderungen erkannt),2026-03-25T13:01:46+01:00,https://www.jobs.ch/de/stellenangebote/detail/cb2a9266-eb65-4ac0-becd-732ba20a0352/
Product Owner / Projektleiter: in AI (80 – 100%),CISTEC AG,Zürich,Dein Profil,"Erfahrung als Product Owner, Requirements Engineer, Solutions Engineer oder technischer Projektleiter. | Technisches Verständnis für AI-Technologien (LLMs, Prompt Engineering, AI Agents) sowie IT-Architekturen und die Fähigkeit, technische Konzepte gegenüber unterschiedlichen Stakeholdern überzeugend zu vertreten. | Ausgeprägte analytische Fähigkeiten und eine strukturierte Arbeitsweise. | Erfahrung im Management komplexer Abhängigkeiten sowie in der Moderation von Kollaborationsprozessen. | Idealerweise Erfahrung in der Umsetzung von IT-Projekten und im Umgang mit (AI-) Automatisierungsplattformen. | Betriebswirtschaftliches Denken sowie eine hohe Affinität für Prozessoptimierung und Automatisierung. | Sehr gute Deutsch- und Englischkenntnisse in Wort und Schrift.",2026-03-04T14:28:30+01:00,https://www.jobs.ch/de/stellenangebote/detail/cc3f752b-2b11-47b4-9fb0-2bb6f14de90a/
Cloud & Infrastructure Engineer,Leister AG,Kägiswil,(Fallback: 2. Aufzählung),"Microsoft Entra ID (Azure AD) & Entra ID Connect | Identity & Access Management (IAM) | Conditional Access, Enterprise Applications, App Registrations | Always On VPN",2026-03-23T20:32:03+01:00,https://www.jobs.ch/de/stellenangebote/detail/f7ab1373-9f44-48d5-b1ed-b79301d3daab/
Projektmanager/in mit Schwerpunkt Wirtschaftsthemen (a),Kanton Luzern,Luzern,Ihr Profil,"Für diese Stabsfunktion bringen Sie ein Hochschulstudium in Wirtschaft oder Recht mit. | Sie verfügen über sehr gute Kenntnisse und Erfahrung in der Lösung von komplexen und vernetzten Aufgaben sowie in konzeptionellen Fragestellungen, insbesondere im Wirtschaftsbereich. | Als flexible und dienstleistungsorientierte Persönlichkeit sind Sie durchsetzungsstark und verhandlungssicher und verfügen über ausgeprägte kommunikative Fähigkeiten sowie stilsicheres Deutsch. | Ihre Arbeitsweise ist selbständig, strukturiert und qualitätsorientiert. Sie handeln ziel- und lösungsorientiert, treten sicher in Gremien, Projektgruppen und politischen Behörden auf. | Interesse und Vertrautheit mit Fragestellungen der öffentlichen Hand, politisches Sensorium sowie eine hohe Affinität zu den Themen des BUWD runden Ihr Profil ab.",2026-03-23T17:01:47+01:00,https://www.jobs.ch/de/stellenangebote/detail/ae112b7c-3a53-4b44-8fe1-cc17ab1c9833/
Projektleiter (w/m/d),Rotzinger AG,Kaiseraugst,ROTZINGER TRANSVER AG ist eine international tätige Coesia-Firma.,Abgeschlossene technische Ausbildung in Maschinenbau oder Elektrotechnik. | Erfahrung im Projektmanagement und Teamführung. | Gute Kommunikations- und Teamfähigkeit.,2026-02-27T12:31:03+01:00,https://www.jobs.ch/de/stellenangebote/detail/088e695a-3074-4014-a61e-2320d0cf4612/
"DHBW-Studium – B.Sc. Studiengang Elektrotechnik, Fachrichtung Automation (m/w/d)",Penta-Electric AG,Liestal,"Penta-Electric ist ein führender Spezialist für industrielle Automation. Wir bieten hohe Wertschätzung, Eigenverantwortung und Selbstständigkeit.",Internationale Erfahrung in unterschiedlichen Branchen erforderlich. | Eigenverantwortung und Selbstständigkeit sind wichtig. | Respekt und Offenheit gegenüber Mitarbeitenden fördern.,2024-01-06T09:33:51+01:00,https://www.jobs.ch/de/stellenangebote/detail/4166a9ff-ea83-4d32-8a56-0ea9edf62a25/
Project Engineer,Bertrams Chemieanlagen AG,Muttenz,Bertrams ist ein führendes Ingenieurbüro im Bereich chemischer Anlagen. Sie bieten spannende Möglichkeiten in einem internationalen Umfeld.,Technische Ausbildung als Maschinenbauingenieur oder Ähnliches. | Sehr gute Englischkenntnisse in Wort und Schrift. | Interesse an technischem Arbeiten und internationalem Austausch.,2025-07-01T10:16:39+02:00,https://www.jobs.ch/de/stellenangebote/detail/1bc5bdd0-ed87-401b-8ff3-d60325ba0011/
"Education Development Manager, 80-100%",Vantage Education AG,Zürich,Das bringst du mit:,"Abgeschlossenes Studium (BSc, MSc, MA), z. B. in Informatik, Innovation, Wirtschaft oder einem verwandten Bereich | Eigene umgesetzte Projekte mit Bezug zu AI, Digitalisierung und idealerweise deren Überführung in konkrete Bildungsangebote oder Lernformate | Erfahrung im Schweizer Bildungssystem (z. B. Lehrgänge, CAS, Berufsbildung oder vergleichbare Formate) | Ausgeprägte konzeptionelle Fähigkeiten kombiniert mit hoher Umsetzungskraft, Pragmatismus und Drive | Sehr gutes Verständnis und Leidenschaft für zukunftsorientierte Bildung, Instructional Design und aktuelle Bildungstrends | Starke Projektmanagement-Kompetenzen sowie strukturierte, analytische Arbeitsweise",2026-03-31T10:33:28+02:00,https://www.jobs.ch/de/stellenangebote/detail/0ace34c6-d13c-4794-b154-6d7728190344/
FHNW-Studium PiBS - B.Sc. Studiengang Informatik (m/w/d),Penta-Electric AG,Liestal,Penta-Electric ist ein führender Spezialist für industrielle Automation.,Erfahrung in der Industrieautomatisierung ist erforderlich. | Eigenverantwortung und Selbstständigkeit sind wichtig. | Respekt und Menschlichkeit prägen unser Miteinander.,2024-06-06T10:08:15+02:00,https://www.jobs.ch/de/stellenangebote/detail/a54e505d-a555-4538-81c7-ad62d0c0e64b/
Projektingenieur,ViaSat Antenna Systems SA,Basel,Viasat bietet eine globale Plattform für innovative Lösungen.,"Mindestens 5 Jahre Erfahrung in komplexer Systemverifikation. | Kenntnisse in TCP/IP, VLANs und Ethernet-Protokollen. | Erfahrung mit Programmiersprachen wie C, C# und Python.",2026-03-15T11:42:08+01:00,https://www.jobs.ch/de/stellenangebote/detail/ee6abe87-36c8-417e-be8c-574f4015dc2b/
PIBS - Bachelorstudium in Biotechnologie an der ZHAW mit integrierten Praktika bei der Syngenta,Syngenta Crop Protection,Stein,Was du mitbringst:,"Leidenschaft und Freude an der Chemie und Analytik | Sorgfältiges, genaues und selbständiges Arbeiten im Labor | Analytisches und lösungsorientiertes Denken | Teamfähigkeit | Gute Deutschkenntnisse",2026-03-24T09:43:27+01:00,https://www.jobs.ch/de/stellenangebote/detail/67ff681f-3824-4423-8d49-cc1ccc70c821/
Praktikum Datenbanktechnik (3 bis 6 Monate) (m/w/d),VP Bank AG,Triesen,VP Bank sucht neugierige Talente mit Kundenorientierung.,"Studium in Informatik, Data Engineering oder vergleichbare Erfahrung. | Gute Kenntnisse in Python und PostgreSQL. | Analytische Fähigkeiten zur Problemlösung und Datenanalyse.",2026-03-23T09:46:54+01:00,https://www.jobs.ch/de/stellenangebote/detail/66892a18-2fb7-4f91-b5bb-173f17918881/
Internet Access,Netkum AG,Brig-Glis,Das bringst du mit,Ausbildung als Informatiker/In EFZ / FH oder andere gleichwertige Ausbildung | Teamplayer/in | Offen für die Kommunikation und Umgang mit Kunden | Nervenstärke bei komplexeren Herausforderungen | Selbständiges Arbeiten | Motiviert sich weiterzuentwickeln | Bereit auch mal Pikettdienst zu leisten,2024-04-11T10:17:17+02:00,https://www.jobs.ch/de/stellenangebote/detail/b3fde3bc-5c2e-4126-9af3-d6c59c9badd6/
Praktikum im Bereich Maschinelles Lernen (m/w) 80-100%,AutoForm Development GmbH,Zurich,In diesem Praktikum wirst du neue ML-Modelle für die Blechumformung implementieren. Du arbeitest in einem experimentellen Umfeld mit einem engagierten Team.,"Master-Abschluss in Informatik, Data Science oder Ingenieurwesen. | Gute Programmierkenntnisse in Python und ML-Frameworks. | Teamfähigkeit und starkes Interesse an technischen Herausforderungen.",2026-01-13T12:07:35+01:00,https://www.jobs.ch/de/stellenangebote/detail/5722b371-42e4-47c4-a382-91df07adc5a3/
Programme Manager Company Programme,Youth.Economy.Switzerland.,Zürich,Dein Profil,"Abgeschlossene Maturität, vorzugsweise begonnenes Studium mit Schwerpunkt Wirtschaftswissenschaften | Sehr gute schulische Zeugnisse und ein ausgeprägtes Interesse an wirtschaftlichen und bildungspolitischen Themen | Erfahrung oder Ausbildung im Projektmanagement von Vorteil | Sehr gute Sprachkenntnisse in Deutsch (Wort und Schrift) | Hohes Mass an Selbstständigkeit, Eigeninitiative, Belastbarkeit und Flexibilität | Strukturiertes und analytisches Denkvermögen sowie exakte und zuverlässige Arbeitsweise | Sehr gute Kenntnisse der Microsoft Office Anwendungen",2026-03-11T09:42:07+01:00,https://www.jobs.ch/de/stellenangebote/detail/3055922a-5cbc-48cf-a050-5a312eda056a/
Senior Epic Application Analyst myChart (a),Insel Gruppe,Berne,Your Profile,"Training in computer science/business informatics and experience in EpicCare Ambulatory, Cogito, Clarity Data Model, Caboodle Data Model as well as good knowledge of SQL and M-code | At least 5 years of proven experience with Epic MyChart across more than two healthcare organizations | Deep understanding of patient-centered digital services and data-driven analytics | Excellent English skills (C2 level) and very good German skills (B1+ level) | Residence in Switzerland and willingness to work on site in Bern at least three days per week",2026-03-23T02:05:46+01:00,https://www.jobs.ch/de/stellenangebote/detail/83df977c-87c2-4fb8-8029-29cc89fc8078/
Initiativbewerbung: Shape the Future with MAIT Swiss,Cytrus AG,St. Gallen,Werde Teil der MAIT Swiss – einem dynamischen Unternehmen! Nutze die Chance auf spannende Projekte in einem modernen Umfeld.,"Abgeschlossene Ausbildung, Interesse an Digitalisierung und IT. | Eigeninitiative und Freude an Verantwortung. | Sehr gute Sprachkenntnisse in Deutsch oder Französisch.",2026-03-05T09:46:46+01:00,https://www.jobs.ch/de/stellenangebote/detail/7f568314-10dc-4015-af98-28a9baa17d68/
Professor:in Getränkeinnovation 80–100 %,ZHAW Zürcher Hochschule für Angewandte Wissenschaften,Zürich,Professor:in Getränkeinnovation gesucht – Gestalten Sie die Zukunft! Nutzen Sie Ihre Expertise in einem inspirierenden Umfeld.,Hochschulstudium mit Promotion in Lebensmittelwissenschaften oder verwandtem Bereich. | Erfahrung in angewandter Forschung und Entwicklung. | Sehr gute Deutschkenntnisse und didaktische Befähigung.,2025-12-21T09:52:24+01:00,https://www.jobs.ch/de/stellenangebote/detail/2ce1c84b-1931-47b0-b071-76e5f9af847e/
Senior Logistic Consultant SAP S/4HANA Cloud Public Edition (all genders),adesso Schweiz AG,Bern,DEINE SKILLS - DAS BRINGST DU MIT,"Abgeschlossenes Studium der Betriebswirtschaftslehre, Wirtschaftsinformatik, Wirtschaftsingenieurwesen oder eine vergleichbare Ausbildung mit Logistik- oder Supply-Chain-Schwerpunkt. | Mehrjährige Beratungserfahrung in der SAP S/4HANA Cloud Public Edition in einem oder mehreren Logistikbereichen (z. B. MM, SD, PP, EWM, TM) sowie idealerweise entsprechende Zertifizierungen. | Gute Kenntnisse in SAP Cloud-Technologien sowie in der Integration und Erweiterung über die Business Technology Platform (BTP), insbesondere im Zusammenspiel von Logistik- und angrenzenden Fachprozessen. | Du hast Freude daran, Logistiklösungen aktiv mitzugestalten, Kunden für Cloud-Ansätze zu begeistern und Mehrwerte verständlich zu vermitteln. | Du kommunizierst sicher auf Deutsch und Englisch, intern sowie extern. Französisch von Vorteil.",2026-02-19T11:43:47+01:00,https://www.jobs.ch/de/stellenangebote/detail/36ed6e33-ef42-42cd-8806-7cab87b05d2e/
Praktikum Batterie- und Hybridbewertung (m/w/d),Axpo Gruppe,Baden,"Praktikum bei Axpo in Baden, 100% Auslastung für 6 Monate.","Studium in Mathematik, Physik oder einem quantitativen Bereich. | Kenntnisse in Optimierung und Zeitreihenanalyse erforderlich. | Vertrautheit mit stochastischen Modellen und numerischen Methoden.",2026-03-26T22:18:53+01:00,https://www.jobs.ch/de/stellenangebote/detail/5930fdbb-62aa-4c50-84c6-2b02a0abab9a/
Praktikum KI & Prozessautomatisierung,HELP Media AG,Zürich,Ihr Profil,"Laufendes oder abgeschlossenes Studium (Informatik, Data Science, Wirtschaftsinformatik, Medien oder vergleichbar) | Sehr gutes technisches Grundverständnis | Starkes Interesse an KI, Automatisierung und Prozessoptimierung | Erfahrung mit KI-Tools und APIs von Vorteil | Selbstständige, strukturierte Arbeitsweise | Pragmatiker-Mindset: ausprobieren, umsetzen, verbessern",2026-02-21T10:05:28+01:00,https://www.jobs.ch/de/stellenangebote/detail/88ccdf28-64c2-44d2-93a9-2c835edf387d/
Senior Cloud SAP BTP Integration Architect (all genders),adesso Schweiz AG,Bern,adesso steht für IT-Exzellenz und bietet hervorragende Entwicklungsmöglichkeiten. Werde Teil eines dynamischen Teams mit innovativen Projekten und Trainings.,"Bachelor-Abschluss in Informatik, MBA oder MS von Vorteil. | Fundierte Kenntnisse in SAP-Technologien wie SAP BTP. | Erfahrung in der Integration von SAP-Lösungen wie S/4HANA.",2026-03-23T10:38:55+01:00,https://www.jobs.ch/de/stellenangebote/detail/421576c2-1fff-46aa-a948-d61b0b02866c/
ICT Engineer M365 / SharePoint / Power Platform 80 - 100 % (w/m/d),Hamilton Services AG,Bonaduz,(nicht gefunden),(keine Anforderungen erkannt),2026-01-24T10:47:20+01:00,https://www.jobs.ch/de/stellenangebote/detail/ba518bcb-10da-4e8d-ad50-59ebb831a421/
(Senior) Consultant Data & Analytics,ti&m AG,Zürich,Werde Teil unseres Teams als Senior Consultant im Bereich Data & AI! Hier erwartet dich ein spannendes Umfeld mit tollen Entwicklungsmöglichkeiten.,Du hast einen Abschluss mit quantitativen Fokus und >5 Jahre Erfahrung. | Du bist ein strategischer und analytischer Denker mit starken Fähigkeiten. | Du hast Erfahrung im Management verschiedenster Stakeholder-Gruppen.,2025-10-09T11:52:22+02:00,https://www.jobs.ch/de/stellenangebote/detail/e7a8afae-8d0c-43b4-9457-f3d138fd37ec/
Praktikum Customer Experience,HOLY FASHION GROUP,Kreuzlingen,Wir suchen eine*n Intern Customer Experience bei HOLY FASHION GROUP! Werde Teil eines dynamischen Teams in Kreuzlingen.,"Laufendes Studium in BWL oder Textilien, idealerweise mit SAP und Excel Kenntnissen. | Sehr gute Deutsch- und Englischkenntnisse in Wort und Schrift. | Hohes Interesse am Vertrieb und Teamarbeit.",2026-03-14T12:33:25+01:00,https://www.jobs.ch/de/stellenangebote/detail/101e1fc9-ada9-48c9-aa9f-2f4a23dda3a8/
Projektleiter/-in IT | SAP | Geschäftsentwicklung 80-100%,ESA-Einkaufsorganisation des Schweizerischen Auto- und Motorfahrzeuggewerbes Genossenschaft,Burgdorf,Werde Teil unseres Teams in Burgdorf und gestalte IT-Projekte! Profitiere von einem dynamischen Umfeld und Entwicklungsmöglichkeiten.,"Sehr gute analytische und konzeptionelle Fähigkeiten erforderlich. | Ausgeprägte, agile Denkweise für komplexe Problemstellungen. | Leitung des CCoE und Teamleitung der Abteilung Gesch&auml;ftsentwicklung.",2026-01-27T09:52:20+01:00,https://www.jobs.ch/de/stellenangebote/detail/a9c4f2e6-fcec-46d1-9ee8-cf669d3e4a22/
LEAN Project Manager 80 – 100 % (w/m/d),Hamilton Services AG,Bonaduz,(nicht gefunden),(keine Anforderungen erkannt),2026-02-26T10:40:16+01:00,https://www.jobs.ch/de/stellenangebote/detail/f8c77af6-4293-466d-a4a6-b6f3f809315d/
Programme Manager Company Programme,Youth.Economy.Switzerland.,Zürich,Dein Profil,"Abgeschlossene Maturität, vorzugsweise begonnenes Studium mit Schwerpunkt Wirtschaftswissenschaften | Sehr gute schulische Zeugnisse und ein ausgeprägtes Interesse an wirtschaftlichen und bildungspolitischen Themen | Erfahrung oder Ausbildung im Projektmanagement von Vorteil | Sehr gute Sprachkenntnisse in Deutsch (Wort und Schrift) | Hohes Mass an Selbstständigkeit, Eigeninitiative, Belastbarkeit und Flexibilität | Strukturiertes und analytisches Denkvermögen sowie exakte und zuverlässige Arbeitsweise | Sehr gute Kenntnisse der Microsoft Office Anwendungen",2026-03-11T09:43:08+01:00,https://www.jobs.ch/de/stellenangebote/detail/12200b3b-70a0-4a68-a711-4845117f9a99/
Senior/Principal Enterprise Architect (w/m/d) - Schweiz,SAP (Schweiz) AG,Zürich-Flughafen,Unabdingbare Anforderungen,"Mehr als 10 Jahre Erfahrung in Enterprise Architecture, IT-Architektur oder verwandten kundenorientierten Rollen mit Verantwortung für End-to-End-Architekturdesign in komplexen hybriden Landschaften",2026-02-25T21:21:19+01:00,https://www.jobs.ch/de/stellenangebote/detail/0f986d16-41ee-447b-919d-491fbf28c969/
Praktikum Lean CI / 5S,SR Technics Switzerland AG,Zürich,Ihr Profil,"Derzeitiges Studium im Bereich Wirtschaftsingenieurwesen, Maschinenbau, Fertigungstechnik, Betriebsmanagement oder einem verwandten Fachgebiet | Grundkenntnisse der Lean Manufacturing-Prinzipien (5S, Verschwendungsbeseitigung, Standardarbeit) | Starke analytische und problemlösende Fähigkeiten | Vertrautheit mit der Arbeit in einer Fertigungs- oder Werkstattumgebung | Gute Kommunikationsfähigkeiten in Deutsch und Englisch, schriftlich und mündlich | Bereitschaft zur Zusammenarbeit mit Bedienern und Ingenieuren | Erfahrung mit CAD, Layout-Design oder Prozessdokumentation (von Vorteil) | Arbeitsberechtigung für die Schweiz ist erforderlich",2026-03-04T11:06:26+01:00,https://www.jobs.ch/de/stellenangebote/detail/cc2721fe-03af-4ade-91b4-6b8bae7f1af4/
Senior BIM Manager für Energieinfrastruktur (w/m/d),Axpo Group,Baden,(nicht gefunden),(keine Anforderungen erkannt),2026-02-24T16:32:30+01:00,https://www.jobs.ch/de/stellenangebote/detail/4838fd5f-6c87-4214-9c1d-289401e0addf/
Senior Manager Agentic AI & Customer Platforms (w/m/d),Möbel Pfister AG,Suhr,Das bringst du mit,"Mehrjährige Erfahrung in AI, Automatisierung oder digitalen Plattformen | Sehr stark im Strukturieren komplexer Transformationen | Technisches Verständnis ohne operative Detailverliebtheit | Erfahrung mit CRM, CCaaS oder vergleichbaren Enterprise Plattformen | Klarer Leadership Stil, ruhig, entscheidungsstark, pragmatisch",2026-02-24T11:32:32+01:00,https://www.jobs.ch/de/stellenangebote/detail/f964911e-0805-4432-aa9e-3ce98edaf44b/
Übernahme von Projekt-/Change-Verantwortung im technischen Bereich,BitHawk AG,Sursee,Das bringst du mit,"Du bringst mehrjährige Berufserfahrung als System Engineer mit und hast dein Wissen durch Aus- und Weiterbildungen im IT-Umfeld kontinuierlich vertieft | Du verfügst über umfassende Kenntnisse im Microsoft Server und Client Umfeld | Mit AZURE Services / AD / O365 arbeitest du routiniert und sicher | Du hast gute Kenntnisse im Umgang mit Exchange on Prem und / oder Exchange Online | Du sprichst fliessend Deutsch, Englischkenntnisse sind ein Plus",2025-07-04T10:27:44+02:00,https://www.jobs.ch/de/stellenangebote/detail/5fdac22f-e5ae-467b-bff3-a8455c8c0415/
"(Senior) BI Consultant Analytics, Qlik (100%) (w/m/d), Schweiz, hybrid",HICO Group AG,Zürich,Was bringst du mit?,"4+ Jahre Erfahrung im Reporting, Design und Aufbau von Dashboards mit Qlik Sense bzw. Qlik Cloud | 4+ Jahre Erfahrung im Consulting | Abgeschlossenes Studium der Informatik, Wirtschaftsinformatik, Wirtschaftswissenschaften oder vergleichbar | Leidenschaft Geschäftsprozesse zu verstehen und Entscheidungen mit Data Analytics Lösungen zu unterstützen und zu optimieren | Wichtige Skills: Qlik Sense mit praktischer Erfahrung, Power BI von Vorteil | Vorteilhafte Skills: IBCS, SAC, Tableau, SQL, SSIS/SSAS, MS Azure, Snowflake, SAP BW, Power Platform | Hervorragende Kommunikations- und Präsentationsfähigkeiten | Sehr gute Deutsch- und Englischkenntnisse | Wohnsitz in der Schweiz oder Umzugsbereitschaft in die Schweiz",2026-03-23T13:04:50+01:00,https://www.jobs.ch/de/stellenangebote/detail/118ec34d-1e35-4ee5-a811-bd6726784c2f/
Mitarbeiter:in Geschäftsentwicklung,Kessler & Co AG,Zürich,Das bringen Sie mit,"Sie sind eine kommunikative Persönlichkeit mit ausgeprägtem Verkaufsflair, hoher Eigenmotivation und Freude am aktiven Kundenkontakt. | Sie verfügen über eine kaufmännische Grundausbildung mit betriebswirtschaftlicher Weiterbildung oder über eine fundierte Ausbildung im Versicherungsumfeld. | Sie haben mehrjährige Arbeitserfahrung im Versicherungsbereich, idealerweise im Corporate-/Unternehmensgeschäft mit mittleren und grossen Unternehmen. | Sie kommunizieren fliessend und stilsicher in Deutsch sowie verhandlungssicher in Englisch (mündlich und schriftlich); zusätzliche Kenntnisse einer weiteren Landessprache sind von Vorteil.",2026-02-21T10:18:22+01:00,https://www.jobs.ch/de/stellenangebote/detail/96d29d62-066e-4c88-9bd9-0e1d605a0a11/
Senior Manager Agentic AI & Customer Platforms (w/m/d),Möbel Pfister AG,Suhr,Pfister sucht tatkräftige Unterstützung für eine Vision.,"Mehrjährige Erfahrung in AI, Automatisierung oder digitalen Plattformen. | Stark im Strukturieren komplexer Transformationen. | Erfahrung mit CRM, CCaaS oder vergleichbaren Enterprise Plattformen.",2026-02-13T11:30:39+01:00,https://www.jobs.ch/de/stellenangebote/detail/6770a6d3-2ba7-41b1-a16b-46015016dec8/
Platform Engineer Modern Client Infrastructure (m/w/d),SBB CFF FFS,Region Bern Mittelland (BE/SO/AG),Das bringst du mit.,"Hohe Teamfähigkeit wird durch aktive Mitarbeit, Förderung des Austauschs sowie die gemeinsame Entwicklung tragfähiger Lösungen unter Beweis gestellt. | Langjährige, umfangreiche Erfahrung im Engineering und Betrieb moderner Client- und Endpoint-Management-Plattformen (Microsoft Intune, Windows 11, Microsoft Entra ID, Autopilot sowie PowerShell-Automation) wird vorausgesetzt. | Ein tiefes Verständnis von Workplace-Sicherheit, Netzwerkgrundlagen und Integrationsarchitekturen zeichnet dich aus. | Ausgeprägte Entscheidungsfreudigkeit zeigt sich darin, dass klare, fundierte technische Entscheidungen getroffen und transparent vertreten werden. | Erfahrung in komplexen Enterprise-Umgebungen mit hohen Anforderungen an Stabilität und Sicherheit ist vorhanden. | Eine höhere technische Ausbildung in Informatik oder Wirtschaftsinformatik (FH, ETH, Uni) oder eine gleichwertige Weiterbildung hast du abgeschlossen und gute Kommunikationsfähigkeiten in Deutsch (C1) sowie Englisch (B2) runden dein Profil ab.",2026-03-23T14:02:15+01:00,https://www.jobs.ch/de/stellenangebote/detail/caef08a5-8176-4ded-946e-c2f9f0b4a367/
Ingenieurin Netzbetrieb & Digitalisierung (alle),IWB Industrielle Werke Basel,Basel,IWB bietet spannende Aufgaben im Bereich KI und Netzbetrieb.,Hochschulabschluss im elektrotechnischen Bereich und IT-Weiterbildung. | Erfahrung als Betriebsingenieur im Stromnetz. | Hohe Affinität für KI-Tools und Kenntnisse in SAP.,2026-02-24T09:54:05+01:00,https://www.jobs.ch/de/stellenangebote/detail/b1bfa234-2379-4dad-a409-d2523eef92cc/
Project Manager,Bertrams Chemieanlagen AG,Muttenz,"Die Universal-Job AG sucht einen Project Manager. Arbeiten Sie in einem spannenden, internationalen Umfeld.",Abschluss als Ingenieur:in in Verfahrenstechnik oder Maschinenbau. | Mehrjährige Erfahrung im Projektmanagement im Anlagenbau. | Fließende Englischkenntnisse in Wort und Schrift.,2025-07-01T10:16:06+02:00,https://www.jobs.ch/de/stellenangebote/detail/bd46b711-4bed-4a93-88a9-8d6ba89a0cd2/
"Senior BI Consultant Data & Cloud, MS Fabric (100%) (w/m/d), Schweiz, hybrid",HICO Group AG,Zürich,Senior BI Consultant Data & Cloud (m/w/d) bei HICO in der Schweiz.,"Studium in Wirtschaftsinformatik oder vergleichbar, 4+ Jahre Erfahrung erforderlich. | Erfahrung mit DWH- und ETL-Technologien wie Qlik und Talend. | Sehr gute Deutsch- und Englischkenntnisse, Problemlösungsfähigkeiten.",2026-03-23T13:10:22+01:00,https://www.jobs.ch/de/stellenangebote/detail/a99e8ce6-802c-4f39-8556-ead2c2d6ab76/
Agile Project Manager,ti&m AG,Bern,Leite agile Entwicklungsprojekte in einem innovativen Unternehmen. Hier erwartet dich ein dynamisches Umfeld mit tollen Möglichkeiten.,Mehrjährige Erfahrung als Projektleiter oder Software Engineer erforderlich. | Sehr gute Kenntnisse in agilen Entwicklungsprozessen und Scrum. | Ausgeprägte Kundenorientierung und hohe Kommunikationsfähigkeit.,2025-10-31T10:26:13+01:00,https://www.jobs.ch/de/stellenangebote/detail/a7ce0900-76be-4622-9dd3-94a293f23b86/
Ingenieurin Netzbetrieb & Digitalisierung (alle),IWB Industrielle Werke Basel,Basel,Damit machst du uns noch besser:,"Du bringst Erfahrung als Betriebsingenieur mit und bist versiert rund um das Thema Stromnetz. | Abgeschlossener Hochschulabschluss im elektrotechnischen Bereich, ergänzt mit einer IT-Weiterbildung. | Du hast bereits Digitalisierungsprojekte erfolgreich umgesetzt oder stark dabei mitgewirkt. | Deine Affinität für verschiedene Tools und KI ist hoch - idealerweise bringst du erste Erfahrungen mit Programmiersprachen mit und kennst dich gut mit SAP aus. | Bereichsübergreifende und proaktive Zusammenarbeit? Da fühlst du dich wohl und bringst deine und andere Interessen zusammen.",2026-03-23T02:04:35+01:00,https://www.jobs.ch/de/stellenangebote/detail/374d053a-d360-41e0-ba1a-3c555044380e/
