titel,unternehmen,arbeitsort,anforderungen_sektion,anforderungen,veroeffentlicht_am,url
Senior Recruitment Consultant in High Level,Engineering Management Selection E.M.S. AG,Bern,Ihr Profil,"Höhere Ausbildung in Technik oder BWL | Sie haben Führungserfahrung im Rahmen einer Kaderfunktion | Verkaufstalent für hochwertige Dienstleistungen | Kommunikationsstärke in Deutsch und Englisch | Unternehmerisches Denken, Ausdauer und Drive",2026-03-12T16:32:46+01:00,https://www.jobs.ch/de/stellenangebote/detail/21cdd32f-8d39-4274-a2f5-a00c6de9a06a/
Abacus Consultant  Finanzen und/oder Personal (a) 60-100%,Consult & Pepper AG,Sursee,Deine Qualitäten und Begabungen,"Abgeschlossene kaufmännische oder betriebswirtschaftliche Ausbildung mit fundierter Praxiserfahrung in der Finanz- oder Lohnbuchhaltung – idealerweise ergänzt durch eine Weiterbildung auf Stufe HF oder FH | Mindestens zwei Jahre Erfahrung in der Einführung und Betreuung von Abacus-Applikationen oder vergleichbaren ERP-Systemen | Vertiefte Kenntnisse sowie ein solides Verständnis für Buchhaltungs- bzw. Payroll- und/oder HR-Prozesse im KMU-Umfeld | Erfahrung in der Projektarbeit ist von Vorteil | IT-Affinität und Zahlenflair, um ERP-Lösungen nicht nur zu verstehen, sondern auch effizient auf Kundenbedürfnisse auszurichten | Mit deiner strukturierten, vernetzten und pragmatischen Arbeitsweise übernimmst du gerne Verantwortung und schätzt die Balance zwischen Selbstständigkeit sowie Teamarbeit | Stilsicheres Deutsch in Wort und Schrift rundet dein Profil ab – Englischkenntnisse sind ein willkommenes Plus | Stilsicheres Deutsch in Wort und Schrift rundet dein Profil ab – Englischkenntnisse sind ein willkommenes Plus",2026-03-30T06:06:53+02:00,https://www.jobs.ch/de/stellenangebote/detail/5dbf3dc3-ffbf-4407-8784-1b932c0a6873/
Sales Manager Distribution Business - Middle East & Africa,Vorwerk Home & Co. KmG,Wollerau,YOUR PROFILE,Strong understanding of distribution structures and consumer behavior in Middle East and Africa,2026-03-08T04:03:03+01:00,https://www.jobs.ch/de/stellenangebote/detail/b2bcb9d0-5afc-4cd6-84e3-81563023f80b/
Content & Digital Marketing Spezialist 60-80% (m/w/d),Nahrin AG,Sarnen,Website und Redaktion,Erstellung redaktioneller Beiträge für unsere Website | Einpflege und Pflege der Inhalte im CMS,2026-03-26T09:47:11+01:00,https://www.jobs.ch/de/stellenangebote/detail/72112cfe-1e35-4401-90fb-24593df183ab/
Junior Assistent:in Wirtschaftsprüfung (m/w/d),Balmer-Etienne AG,Bern,Du möchtest Verantwortung übernehmen und in die Wirtschaftsprüfung einsteigen? Wenn du ausserdem...,"eine abgeschlossene kaufmännische Grundausbildung hast, | dich aktuell in einem betriebswirtschaftlichen Studium (Hochschule oder Universität in der Schweiz) befindest oder ein solches planst, | Interesse am Gebiet der Wirtschaftsprüfung hast, | eine selbstständige, exakte und flexible Arbeitsweise sowie | sehr gute Deutschkenntnisse und gute Englisch- oder Französischkenntnisse mitbringst,",2026-02-20T10:40:54+01:00,https://www.jobs.ch/de/stellenangebote/detail/a4af40c3-79df-429c-b4a4-f7cdde0977e6/
Leiter:in Entwicklung und Akquisition 80-100%,Renggli AG,Sursee,Deine Person,"Fundierte Ausbildung im Bau-, Architektur- oder Immobilienumfeld – idealerweise ergänzt durch betriebswirtschaftliches Denken. | Mehrjährige Führungserfahrung im Schweizer GU-/TU- oder Entwicklungsumfeld. | Empathische, integrative Führungspersönlichkeit mit natürlicher Autorität und Entscheidungsstärke. | Erfahrung in Projektentwicklung und Akquisition, inklusive Kalkulation, Angebotsführung und Vertragsabschluss. | Sicher im Aufbau und in der Pflege von Beziehungen zu Investoren, Eigentümer:innen, Architekt:innen und Behörden – auch in Entwicklungs- und Bewilligungsverfahren | Interesse an nachhaltigem Bauen, Lebenszyklusdenken und langfristiger Wirkung.",2026-03-11T08:02:47+01:00,https://www.jobs.ch/de/stellenangebote/detail/064d143a-7fb1-4c7c-9c0c-6298309bb9fe/
Projektleiter Energieversorgung - Mittel- und Hochspannung (w/m/d) 80-100%,LHH,Zug,? Damit bringst Du uns weiter:,"Abgeschlossenes Studium als | Mindestens | im Bereich Energieverteilung, insbesondere in | Expertise in | von Vorteil | Sicher im | Erfahrung mit | wie MS-Project | sowie gute Englischkenntnisse",2026-03-24T13:03:33+01:00,https://www.jobs.ch/de/stellenangebote/detail/48e614d2-3c4a-48fc-9a39-2accd5f5072a/
Senior Network Software Development Engineer Linux / C++,RUAG AG,Zürich Seebach,(Fallback: 2. Aufzählung),"Higher education in Computer Science or Electrical Engineering (or equivalent qualification). | Professional experience in object-oriented software development (C, C++, Python) for network technology; ideally in the embedded security field (TPM, Secure Boot, System Management, etc.). | Strong Linux expertise with deep knowledge of network engineering (IP across all protocol layers, routing, Linux Netlink layer). | Proficiency in German or English, with a strong willingness to further develop German language skills.",2026-03-28T05:02:51+01:00,https://www.jobs.ch/de/stellenangebote/detail/1f696a9f-3f63-47d3-9038-000bc1305615/
Immobilienbewirtschaftungsprofi / IT Consultant 80-100% per sofort oder nach Vereinbarung,W&W IMMO INFORMATIK AG,Affoltern am Albis,Das erwartet dich,Eine abwechslungsreiche sowie verantwortungsvolle Tätigkeit | Homeoffice als Option (bis zu 60% des Arbeitspensums) | Ein wertschätzendes Arbeitsumfeld mit einem motivierten Team | Ein angemessenes Salär und gute Sozialleistungen | Zeitliche und finanzielle Unterstützung von Weiterbildungen | Eine garantierte 40-Stunden-Woche | kostenlose Parkplätze | und vieles mehr...,2026-03-09T15:10:44+01:00,https://www.jobs.ch/de/stellenangebote/detail/ae700637-d16a-4fc0-a35f-ef08346ad1f6/
Bildungsbeauftragte:r «Führung & Management» 80-100%,ARTISET Bildung,Luzern,Was du mitbringst – und was uns begeistert:,"Tertiäre Ausbildung, vorzugsweise im Sozial-, Gesundheits-, Bildungsbereich oder Betriebswirtschaft und/oder eine fundierte Weiterbildung. | Erfahrungen in der Erwachsenenbildung und einen entsprechenden Abschluss im Bereich der Höheren Berufsbildung (z.B. FA Ausbilder:in oder dipl. Erwachsenenbildner:in HF) oder Bereitschaft, diesen zeitnah zu erlangen. | Mehrjährige Praxiserfahrung, idealerweise mit Führungserfahrung und/oder Leitungspositionen, dadurch vertiefte Kenntnis der Berufswelten im Gesundheits- und Sozialbereich und den Herausforderungen der Branche und dort agierenden Leitungspersonen. | Freude an aktiver Beratung, Beziehungsgestaltung und daran, Bildungsanliegen von Organisationen in passende Angebote zu übersetzen. | Idealerweise Erfahrungen mit modernen, digitalen und hybriden Bildungsformaten und Umgang mit Lernplattformen, digitalen Tools und Infrastruktur (Teams, Open Olat u.a.). | Sehr gute IT?Kompetenzen und hohe digitale Affinität, idealerweise Erfahrungen mit Lernplattformen, digitalen Tools und Infrastruktur (Teams, Open Olat u.a.). | Strukturierte und selbstständige Arbeitsweise mit hohem Qualitätsanspruch und Umsetzungsstärke. | Ausgeprägte Kommunikations- und Kooperationsfähigkeit. | Hohe Selbst- und Sozialkompetenz, gepaart mit einer lösungsorientierten Arbeitsweise.",2026-03-27T12:34:28+01:00,https://www.jobs.ch/de/stellenangebote/detail/0defae21-c43f-4f39-8a29-a4acdaef2db4/
Account Executive (m/w/d) - Fokus New Business GIS / Software - 80-100 %,ESRI Schweiz AG,Zürich,Das wünschen wir uns von Dir,"Du bringst nachweisliche Erfolge in der eigenständigen Gewinnung neuer Kunden mit | Du verfügst über ein fundiertes Verständnis komplexer Entscheidungsprozesse, Buying Center und strategischer Verkaufszyklen | Eine hohe Abschlussstärke, Eigeninitiative und unternehmerisches Denken zeichnen Dich aus | Erfahrung im Geoinformations-, Daten-, Technologie- oder Software-Infrastrukturumfeld (z. B. GIS, Location Intelligence, IT-Plattformen) ist von Vorteil, aber keine Voraussetzung | Sehr gute Deutschkenntnisse sowie gute Englischkenntnisse sind für Dich selbstverständlich; Französisch ist ein Plus",2026-03-04T17:10:39+01:00,https://www.jobs.ch/de/stellenangebote/detail/ebcb07d1-4d6d-41ef-9545-66c4e211727f/
"Head of Digital Marketing & Growth (m/w/d) – Edelmetallbank, Standort Liechtenstein",Partes AG,Vaduz,Was Du mitbringst:,"Mehr als 5 Jahre Erfahrung in Digital & Growth Marketing idealerweise im Finanz-, Investment- oder Edelmetallbereich. | Nachweisbare Erfahrung im Aufbau und der Führung von Teams verbunden mit der Fähigkeit, Teammitglieder aus unterschiedlichen Fachbereichen zu inspirieren, zu coachen und weiterzuentwickeln | Erfahrung bei der Lancierung und Skalierung von digitalen Plattformen, Apps oder Produkten – idealerweise mit Fokus auf hochwertige Investments | Starke analytische Fähigkeiten, praktische Erfahrung und Hands-on-Mentalität im Umgang mit SEO, SEA, Social Ads, Programmatic & Conversion Optimization. | Erfahrung mit MarTech-Stacks (Google Analytics, CRM, Automatisierungstools, A/B-Testing, Tracking-Technologien). | Ausgeprägte Stakeholder-Management- und Kommunikationsfähigkeiten, um mit internen & externen Stakeholdern auf Augenhöhe zu arbeiten. | Innovationsgeist & strategisches Denken – Du bist bereit, neue Wege zu gehen und digitale Trends für uns nutzbar zu machen. | Deutsch auf Niveau Muttersprache, sehr gute Englischkenntnisse in Wort und Schrift",2026-03-06T17:17:07+01:00,https://www.jobs.ch/de/stellenangebote/detail/60c01113-a774-46bc-89b2-7def268066da/
"Asset Manager Gastransportanlagen (m/f/d) 100%, per sofort oder nach Vereinba-rung",Gasverbund Mittelland AG,Arlesheim,Anforderungen:,"Technische Ausbildung (HF/FH/Uni) im Bereich Maschinenbau, Elektrotechnik, Verfahrenstechnik, Energietechnik oder vergleichbar | Mehrjährige Erfahrung im technischen Anlagenmanagement oder in einer vergleichbaren Funktion | Kenntnisse im Umfeld von Energie- oder Infrastrukturanlagen, idealerweise Gastransport | Erfahrung in Lebenszyklusplanung, Risikomanagement und Werterhaltung von Vorteil | Analytische und strukturierte Arbeitsweise | Belastbar, zuverlässig und exakt | Fahrausweis Kat. B",2026-03-25T10:34:26+01:00,https://www.jobs.ch/de/stellenangebote/detail/9a2ec358-ff5a-4fdb-8160-ef71cabb3132/
Elektroplaner - Notlicht und Lichtsteuerung (m/w/d),Zumtobel Group,Zürich,Kenntnisse & Erfahrung,"Abgeschlossene Ausbildung in Elektroplanung, Elektrotechnik, Automatisierungstechnik oder vergleichbarer Fachrichtung | Mehrjährige Berufserfahrung in der Elektro- bzw. Gebäudeautomation | Fundierte Kenntnisse in Steuerungstechnik sowie relevanten Normen und Standards der Gebäudetechnik | Sicherer Umgang mit CAD-Programmen und technischem Planlesen | Hohes analytisches Denkvermögen, Problemlösungsstärke und selbstständige, zuverlässige Arbeitsweise | Starke Kommunikations- und Teamfähigkeit im Umgang mit Kunden und Kollegen",2026-03-02T14:04:12+01:00,https://www.jobs.ch/de/stellenangebote/detail/20f5daba-db2e-4f50-905d-659c6440c8a2/
"Stv. Leiter Asset Management & IT 80-100% (m, w, d)",Elektrizitätswerk Jona-Rapperswil AG,Jona,Was Sie mitbringen,"Fachhochschulabschluss in Elektrotechnik oder in einem verwandten Gebiet | Ausgewiesene Erfahrungen in der Netzwirtschaft (Netzplanung, Smart Grid, GIS, etc.) | Erfahrungen im Messwesen, im Umgang mit Messdaten und mit Messdatenbilanzierungen | Erfahrungen in der Leitung von Projekten (Planung, Beschaffung, Realisierung) | Vertiefte Kenntnisse im Bereich der Digitalisierung und der IT | Ausgewiesene Führungserfahrung | Sehr gute Kommunikations- und Teamfähigkeit | Unternehmerische, selbständige und verantwortungsbewusste Persönlichkeit",2026-03-27T15:05:23+01:00,https://www.jobs.ch/de/stellenangebote/detail/8fd9149a-c6d6-4884-8470-e6f6a5ac0037/
HR Business Partner / HR Professional (a),Stier & Partner GmbH,Zug,(alle Aufzählungen),Beratung und Unterstützung von Führungskräften und Mitarbeitenden in personalrelevanten Fragestellungen entlang des gesamten Employee Lifecycle | Begleitung organisatorischer Veränderungen sowie Unterstützung bei der Umsetzung von HR- Initiativen und Projekten | Enge Zusammenarbeit mit verschiedenen Fachbereichen sowie mit HR-Kolleginnen und Kollegen im internationalen Umfeld | Analyse von HR-Kennzahlen und Unterstützung bei der Weiterentwicklung von HR-Instrumenten und Prozessen | Mitarbeit in operativen HR-Themen sowie Unterstützung bei administrativen Aufgaben | Sicherstellung einer professionellen und vertrauensvollen Betreuung von Führungskräften und Mitarbeitenden,2026-03-27T14:03:41+01:00,https://www.jobs.ch/de/stellenangebote/detail/6941cbe6-640c-41b7-8030-8a334ae00d22/
1st & 2nd Level IT-Supporter:in 80-100%,p3b ag,Bern,Dein Profil,"Abgeschlossene Ausbildung in der Informatik auf Stufe EFZ, FH oder HF | Erste Berufserfahrung als ICT-Supporter:in kannst du ausweisen | Kenntnisse in | sowie | bringst du mit | Basiswissen in der Virtualisierung und der Netzwerktechnik runden dein Profil ab | von Vorteil | Deutsch in Wort und Schrift ( | ) ist ein Muss. Jede weitere Sprache (z.B. Französisch, Englisch) ein Plus",2026-03-26T10:30:41+01:00,https://www.jobs.ch/de/stellenangebote/detail/e343a125-4648-4abb-b8e8-1b68422732bb/
(Junior) Specialist Verkaufsinnendienst & Partnerwesen DE/FR 100% (m/w/d),OBI Bau- und Heimwerkermärkte Systemzentrale (Schweiz) GmbH,Schaffhausen,Dein Profil:,"Abgeschlossene kaufmännische Ausbildung oder ein Studium mit betriebswirtschaftlichem Fokus. | Fundierte Berufserfahrung im operativen Umfeld, idealerweise im Partner Management, Customer Operations oder in der Vertriebskoordination. | Hohes Mass an Struktur, Zuverlässigkeit und ein ausgeprägtes Verständnis für Datenqualität und prozessorientiertes Arbeiten. | Analytisches Denkvermögen kombiniert mit kaufmännischem Verständnis, um komplexe Abläufe praxisnah zu verbessern. | Verhandlungssichere Deutsch- und Französischkenntnisse; Italienischkenntnisse von Vorteil",2026-03-02T15:04:32+01:00,https://www.jobs.ch/de/stellenangebote/detail/ce1f562d-a39f-4120-afb5-98e90ac1d112/
Sales Support Agent (m/w/d) (100% oder Jobsharing 50-50% möglich),CWS-boco Suisse SA,Glattbrugg,"Wie stellst Du sicher, dass wir den besten Service bieten? Wir bei CWS-Hygiene glauben, dass es entscheidend ist, dass Du sowohl persönlich als auch kulturell zu uns passt. Du hast eine Leidenschaft für Dienstleistungslösungen, willst der/die Beste sein und bringst eine hohe Einsatzbereitschaft mit. Du bist in der Lage, die Bedürfnisse unserer Kunden zu erkennen und in erstklassige Lösungen umzusetzen.","Du bringst eine kaufmännische Grundausbildung oder eine vergleichbare Qualifikation mit, idealerweise ergänzt durch Erfahrung im Kundendienst oder Verkaufsinnendienst | Erfahrung mit ERP- und CRM-Systemen (z. B. Salesforce, Microsoft Dynamics D365) sowie fundierte Kenntnisse in Microsoft Office-Anwendungen machen dich besonders geeignet | Du sprichst fliessend Deutsch und verfügst idealerweise auch über Französischkenntnisse in Wort und Schrift; Englisch oder Italienisch sind von Vorteil | Mit deiner strukturierten, proaktiven und lösungsorientierten Arbeitsweise überzeugst du als Teamplayer und Problemlöser | Du bist es gewohnt deine Arbeitstage selbständig und strukturiert zu planen und behältst auch in hektischen Situationen den Überblick | Flexibilität und die Fähigkeit, neue Softwaretechnologien schnell zu erlernen und anzuwenden, zeichnen dich aus | Dein motiviertes Auftreten und deine Zuverlässigkeit runden dein Profil ab, sodass du sowohl eigenständig als auch zielorientiert arbeiten kannst",2026-02-25T13:37:40+01:00,https://www.jobs.ch/de/stellenangebote/detail/ccfb8a7a-d70e-40eb-ab34-39053c605084/
Kundenberater:in Private Vermögens- und Finanzberatung (60% – 100%),Basellandschaftliche Kantonalbank,Aesch,Dein Profil,"verfügst über eine breite Beratungskompetenz mit mindestens 10-jähriger Bank-Erfahrung und eigenem Kundenbuch | brennst für Finanzierungs-, Anlage- und Vorsorgethemen und dein ausgewiesener Verkaufserfolg bestätigt deine Leidenschaft dafür | bist sprachgewandt, hast Freude am Kontakt mit Menschen und die Gabe, sie mit deiner positiven Ausstrahlung und deiner offenen, aufgestellten Art zu gewinnen | bringst ein etabliertes Netzwerk mit und hast die Fähigkeit, nachhaltige und vertrauensvolle Geschäftsbeziehungen aufzubauen und zu pflegen | zeichnest dich durch deine initiative, strukturierte und organisierte Arbeitsweise aus | darfst dich Finanzberater:in nennen oder hast eine andere funktionsrelevante Weiterbildung absolviert",2026-03-04T10:32:56+01:00,https://www.jobs.ch/de/stellenangebote/detail/a4ffc9fd-729e-4e16-8448-23729840babd/
Assistenz Key Account Management Deutsch/Französisch,Pistor AG,Rothenburg / Luzern,Dein Profil,"Kaufmännische Ausbildung oder gleichwertiger Bildungsweg | Mehrjährige Berufserfahrung, idealerweise im Verkaufsinnendienst, Kundenservice und mit Key Accounts | Stilsichere Deutsch- und Französischkenntnisse sind ein Muss | Sehr gute Kenntnisse im MS-Office-Paket, insbesondere Excel | Gute IT-Affinität (z. B. ERP-Systeme, CRM, Teams oder BI von Vorteil) | Erfahrung im Lebensmittelbereich oder im Grosshandel von Vorteil | Interesse an betriebswirtschaftlichen Kennzahlen und analytischen Auswertungen | Ausgeprägte Kundenorientierung | Initiativ, zuverlässig und selbständig in der Arbeitsweise | Prozessorientiertes Denken und rasche Auffassungsgabe | Belastbare Persönlichkeit mit der Fähigkeit, Prioritäten richtig zu setzen | Teamorientiert, durchsetzungs- und kommunikationsstark",2026-03-10T12:49:35+01:00,https://www.jobs.ch/de/stellenangebote/detail/ea78d6ff-3f8e-439d-b465-26d140a9d59c/
Dozent oder Dozentin (60-80 %),,,(nicht gefunden),(keine Anforderungen erkannt),,https://www.jobs.ch/de/stellenangebote/detail/84720467-66fa-4d41-bf48-546e6bc6b659/
Junior Bauführer (m/w/d),Braumann Tiefbau AG,Neuhausen am Rheinfall,FREUEN SIE SICH AUF,Ihre verantwortungsvolle Rolle als Ansprechpartner – stehen Sie in direktem | Austausch mit unseren Kunden und Kolleg:innen innerhalb der | Unternehmensgruppe,2026-03-25T15:37:19+01:00,https://www.jobs.ch/de/stellenangebote/detail/108bd2f7-cbef-49ae-82f3-1ce39aacf193/
Product Management Lead (m/f/a),HAPA AG,Volketswil,"The role balances portfolio strategy and roadmap leadership with strong execution of inbound product management (VoC/VoM, requirements, business cases) and outbound product management (go-to-market enablement, launch readiness), primarily through robust New Product Introduction (NPI) governance and cross-functional execution.","Degree in Engineering, Industrial Engineering, Packaging Technology, or a related field (MBA or advanced business qualification is a plus) | At least 5 years of experience in product management, portfolio management, or business development in machinery orientated markets | Fluency in English and German | Team leadership experience is strongly preferred | Experience in both inbound (VoC/VoM, requirements, business cases) and outbound (go-to-market, launches/NPI) product management | Solid technical understanding of industrial technologies (e.g. automation, digital printing, packaging equipment, mechatronics) | Experience leading complex cross-functional programs in a structured environment (e.g. NPI, stage-gate) | Strategic mindset with strong commercial acumen (pricing, margins, lifecycle profitability) and excellent communication skills | Ability to set priorities, drive accountability, and operate effectively in a dynamic environment | Experience in healthcare/pharma is a must and consumer packaging is a plus",2026-03-20T10:46:14+01:00,https://www.jobs.ch/de/stellenangebote/detail/bda569e2-7cef-4309-b3a2-ffded387ad73/
Manager – Treuhand / Business Tax – Tax & Legal,Deloitte AG,Bern,"Deloitte sucht einen Manager in Bern im Bereich Treuhand und Business Tax. Eine spannende Chance für Fachkräfte, die sich weiterentwickeln möchten.","Diplom im Bereich Treuhand, Steuern oder Wirtschaftsprüfung erforderlich. | Ausgezeichnete Kommunikationsfähigkeiten und Kundenorientierung. | Führungsqualitäten und Teammanagement.",2026-03-03T07:02:44+01:00,https://www.jobs.ch/de/stellenangebote/detail/9228c3f1-e082-4de8-88eb-99f7e4e16ce3/
Koordinator/-in Risikomanagement Bund und Business Continuity Management,Bundesverwaltung,Bern,(Fallback: 2. Aufzählung),"Universität oder Fachhochschule; erfahren im Risikomanagement und im Business Continuity Management (BCM) | Analytisches und konzeptionelles Denken sowie rasche Auffassungsgabe; technisches Flair und kommunikativ | Belastbar, eigenverantwortlich, team-, ziel- und ergebnisorientiert | Verhandlungsgeschick und Durchsetzungsvermögen | Gute Kenntnisse in zwei Amtssprachen sowie des Englischen werden vorausgesetzt; passive Kenntnisse der dritten Amtssprache von Vorteil",2026-03-04T05:02:53+01:00,https://www.jobs.ch/de/stellenangebote/detail/ffd4cb39-4469-4b27-8874-dc24512635aa/
HR Business Partner (a),Pilatus Flugzeugwerke AG,Stans,(Fallback: 2. Aufzählung),"Studium in Human Resources, Betriebswirtschaft, Psychologie oder vergleichbare HR-Weiterbildung mit mehrjähriger Erfahrung in der HR-Beratung. | Ausgeprägte Beratungs-, Kommunikations- und Stakeholder-Management-Kompetenzen sowie sicheres Auftreten mit angemessenem Durchsetzungsvermögen. | Erfahrung im Projekt- und Change-Management sowie gutes Verständnis für organisationsübergreifende HR-Prozesse. | Sehr gute Deutsch- und Englischkenntnisse (mindestens Niveau B2) sowie sicherer Umgang mit MS Office und HR-Systemen wie SuccessFactors. | Resiliente, lösungsorientierte Persönlichkeit mit «Can-do»-Mentalität und strukturierter Arbeitsweise. | Teamorientierter, kommunikationsstarker Brückenbauer, der mit positivem Mindset aktiv zur Zusammenarbeit und Weiterentwicklung der Organisation beiträgt.",2026-03-30T05:02:49+02:00,https://www.jobs.ch/de/stellenangebote/detail/8339cb0a-af60-4f62-88cc-463e333f51d4/
Mitarbeiter:in IT First Level Support (70 – 100 %) – Fokus Anwender-Support & Infrastruktur,Ortho-Team AG,Bern,Dein Benefit,"Sinnstiftende Aufgabe: Ein medizinisches Umfeld, in dem der Mensch im Mittelpunkt steht. | Zentraler Arbeitsplatz: Ein modernes Büro in Bern (hoher Präsenzanteil für echten Teamspirit) mit Homeoffice-Option. | Teamgeist: Ein 4-köpfiges IT-Team und insgesamt 20 Kolleg:innen in den zentralen Diensten, die sich auf dich freuen. | Ferien: 5 Wochen mit Option auf 6 Wochen",2026-03-30T16:23:08+02:00,https://www.jobs.ch/de/stellenangebote/detail/2cab787b-722f-4c7f-84c2-928df383d572/
"Leiter/in Business Development (Finanzen, Recht, Administration) 100%",Crest Management Consultants (Schweiz) GmbH,Raum Sursee,Ihr Profil,"Abgeschlossenes Studium in Betriebswirtschaft, Finanzen, Recht oder einem verwandten Bereich. | Mehrjährige Erfahrung in einer vergleichbaren Position, idealerweise in einem internationalen Umfeld. | Fundierte Kenntnisse in den Bereichen Finanzen, Recht und Administration. | Ausgeprägte analytische und strategische Fähigkeiten, unternehmerisches Denken, strukturierte Vorgehensweise, Verantwortungsbereitschaft, usw. | Sie kennen sich mit den gängigen Finanz- und ERP-Systemen und finden sich schnell zurecht mit neuen Tools | Erfahrung in der Führung und Entwicklung von Teams. | Exzellente Kommunikations- und Verhandlungsfähigkeiten. | Fliessende Deutsch- und Englischkenntnisse in Wort und Schrift.",2026-03-27T13:38:47+01:00,https://www.jobs.ch/de/stellenangebote/detail/6fed8b9c-ac00-4c99-976c-a5bf4570c4f4/
Senior Elektroprojektleiter Betrieb und Infrastruktur (80-100%),Stier & Partner GmbH,Zug,(alle Aufzählungen),"Leitung und Koordination von elektrotechnischen Projekten auf dem Areal | Planung, Begleitung und Überwachung von Neuinstallationen, Umbauten und Sanierungen | Sicherstellung der Energieversorgung im Niederspannungsbereich | Selbständige Störungsanalyse sowie Fehlerbehebung an Elektro und Infrastrukturanlagen | Durchführung von Reparaturen und Instandhaltungsarbeiten | Koordination und Steuerung externer Dienstleister | Beratung der Bauherrschaft bei Neu und Umbauten | Beschaffung und Verwaltung von Ersatzteilen und Betriebsmaterial | Pflege und Aktualisierung der technischen Dokumentation | Mitarbeit im Pikettdienst (separat vergütet)",2026-03-18T16:33:43+01:00,https://www.jobs.ch/de/stellenangebote/detail/fd89f01f-a9fb-4c0a-b510-b59932d84c83/
Departementsmanagerin/​ Departementsmanager Psychosomatische Medizin und Psychotherapie (a),Barmelweid Gruppe AG,Barmelweid,(Fallback: 2. Aufzählung),"als motivierte und engagierte Persönlichkeit, die Freude daran hat, Veränderungsprozesse aktiv mitzugestalten und Verantwortung zu übernehmen. | mit deinem analytischen Denken, deiner Ausdauer und deiner ausgeprägten Kommunikationsstärke, die dich für diesen vielseitigen Aufgabenbereich auszeichnen. Loyalität und die Fähigkeit, dich in unterschiedliche Berufsgruppen hineinzuversetzen, gehören zu deinen zentralen Kompetenzen. | mit deiner Ausbildung im therapeutischen oder medizinischen Bereich sowie mehreren Jahren Berufserfahrung im Projekt‑, Departements‑ oder Klinikmanagement – oder in einer vergleichbaren Funktion – und deinem fundierten Verständnis betriebswirtschaftlicher Zusammenhänge. | mit deinem stilsicheren Deutsch und guten Englischkenntnissen. | mit deinen sehr guten IT‑Kenntnissen und deiner spürbaren Affinität für digitale Technologien.",2026-03-10T10:37:31+01:00,https://www.jobs.ch/de/stellenangebote/detail/cf67cd88-c232-4ab7-9c15-28b81f09307c/
